<?xml version="1.0" encoding="UTF-8"?>
<!DOCTYPE Preview SYSTEM "preview.dtd">
<Preview>
  <preview_image display="portrait,square"
                 name="Note"
                 preview="true">
                 
    <reference screenName="BaseScreen0" />
    <reference screenName="TouchPaneHorizontal0" />
    <reference screenName="MainScrollBar0" />
    <Element compName="bg_list_pane_g1"
             display="!360x640"
             skinId="qsn_bg_column_0"
             varietyId="0" />
    <Element compName="bg_list_pane_g1"
             display="360x640"
             loc_id="&lt;LC&gt;application_window@v:0&lt;/LC&gt;&lt;LC&gt;main_pane@v:18&lt;/LC&gt;&lt;LC&gt;bg_list_pane@v:0&lt;/LC&gt;"
             skinId="qsn_bg_column_0"
             varietyId="0" />
    <Element compName="bg_list_pane_g3"
             display="!360x640"
             skinId="qsn_bg_slice_list_0"
             varietyId="0" />
    <reference screenName="Profiles" />
    <!--<Element compName="screen_g1"
             image="screen_dimmer.svg"
             opacity="40"
             varietyId="0" />-->
    <Element compName="bg_popup_window_pane"
             display="!360x640"
             loc_id="&lt;LC&gt;main_pane@v:3#r:1&lt;/LC&gt;&lt;LC&gt;popup_query_data_window@v:0&lt;/LC&gt;"
             opacity="255"
             skinId="qsn_fr_popup"
             varietyId="0" />
    <Element colourId="text19"
             compName="popup_query_data_window_t2"
             display="!360x640"
             loc_id="&lt;LC&gt;main_pane@v:3#r:1&lt;/LC&gt;&lt;LC&gt;popup_query_data_window@v:0#r:1&lt;/LC&gt;"
             text="Activated profile:"
             varietyId="1" />
    <Element colourId="text19"
             compName="popup_query_data_window_t3"
             display="!360x640"
             loc_id="&lt;LC&gt;main_pane@v:3#r:1&lt;/LC&gt;&lt;LC&gt;popup_query_data_window@v:0#r:1&lt;/LC&gt;"
             text="General"
             varietyId="1" />
    <Element compName="popup_note_window_g1"
             display="!360x640"
             skinId="qgn_note_ok_anim"
             varietyId="0" /><!--
    <Element compName="bg_popup_window_pane"
             display="360x640"
             loc_id="&lt;LC&gt;main_pane@v:10&lt;/LC&gt;&lt;LC&gt;popup_query_data_window@v:0&lt;/LC&gt;&lt;LC&gt;popup_note_wait_window@v:0&lt;/LC&gt;"
             opacity="255"
             skinId="qsn_fr_popup"
             varietyId="0" />
             
    --><Element compName="bg_profile_popup_window_pane"
             display="360x640"
             opacity="255"
             skinId="qsn_fr_popup_preview"
             varietyId="0" />
    <Element colourId="text55"
             compName="profile_popup_window_text"
             display="360x640"
             text="Activated profile: General"
             varietyId="0" />         
             
                      
    <!--<Element colourId="text19"
             compName="popup_query_data_window_t2"
             display="360x640"
             loc_id="&lt;LC&gt;main_pane@v:10&lt;/LC&gt;&lt;LC&gt;popup_query_data_window@v:0&lt;/LC&gt;&lt;LC&gt;popup_note_wait_window@v:0&lt;/LC&gt;"
             text="Activated profile:"
             varietyId="1" />
    <Element colourId="text19"
             compName="popup_query_data_window_t3"
             display="360x640"
             loc_id="&lt;LC&gt;main_pane@v:10&lt;/LC&gt;&lt;LC&gt;popup_query_data_window@v:0&lt;/LC&gt;&lt;LC&gt;popup_note_wait_window@v:0&lt;/LC&gt;"
             text="General"
             varietyId="1" />
    <Element compName="popup_note_window_g1"
             display="360x640"
             loc_id="&lt;LC&gt;main_pane@v:10&lt;/LC&gt;&lt;LC&gt;popup_query_data_window@v:0&lt;/LC&gt;&lt;LC&gt;popup_note_wait_window@v:0&lt;/LC&gt;"
             skinId="qgn_note_ok_anim"
             varietyId="0" />
    --><!-- control pane contents -->
    <!--     <Element skinId="qsn_bg_slice_popup"
                        compName="bg_popup_window_pane_g10" varietyId="0"
                        loc_id="&lt;LC&gt;popup_menu_window@v:13&lt;/LC&gt;&lt;LC&gt;bg_popup_window_pane@v:0&lt;/LC&gt;" />
                <Element skinId="qsn_bg_area_control_popup"
                        compName="control_pane_g3" varietyId="0" /> -->
    <reference screenName="BaseSoftkeys" />
    <Element colourId="text13"
             compName="control_pane_t1"
             loc_id="&lt;LC&gt;area_bottom_pane@v:0&lt;/LC&gt;"
             text="Options"
             varietyId="4" />
    <Element colourId="text14"
             compName="control_pane_t2"
             loc_id="&lt;LC&gt;area_bottom_pane@v:0&lt;/LC&gt;"
             text="Back"
             varietyId="4" />

  </preview_image>
</Preview>