<?xml version="1.0" encoding="UTF-8"?>
<!DOCTYPE Preview SYSTEM "preview.dtd">
<Preview>
  <preview_image display="360x640"
                 name="Music Player"
                 preview="true">
    <Element compName="screen_g1"
             skinId="qsn_bg_screen"
             varietyId="0" />
    <Element compName="status_pane"
             loc_id="&lt;LC&gt;area_top_pane@v:7&lt;/LC&gt;"
             skinId="qsn_fr_status_flat"
             varietyId="1" />
    <Element compName="battery_pane_g1"
             skinId="qgn_indi_battery_strength"
             varietyId="0" />
    <Element compName="signal_pane_g1"
             skinId="qgn_indi_signal_strength"
             varietyId="0" />
    <Element colourId="icon5"
             compName="signal_pane_g2"
             image="qgn_prop_signal_icon.svg"
             varietyId="0" />
    <Element colourId="icon6"
             compName="battery_pane_g2"
             image="qgn_prop_battery_icon.svg"
             varietyId="0" />
	<Element colourId="text6"
			compName="main_mup2_t3"
             text="2/2"
             varietyId="0" />
	<Element colourId="text13"
             compName="control_pane_t1"
             loc_id="&lt;LC&gt;area_bottom_pane@v:0&lt;/LC&gt;"
             text="Options"
             varietyId="4" />
    <Element colourId="text14"
             compName="control_pane_t2"
             loc_id="&lt;LC&gt;area_bottom_pane@v:0&lt;/LC&gt;"
             text="Back"
             varietyId="4" />
    <Element compName="popup_mup3_control_window"
             display="360x640"
             loc_id="&lt;LC&gt;application_window@v:0&lt;/LC&gt;&lt;LC&gt;main_pane@v:20&lt;/LC&gt;&lt;LC&gt;main_mup3_pane@v:0&lt;/LC&gt;"
             skinId="qgn_indi_mup_default_album"
             varietyId="0" />
    <Element compName="main_mup_bar_pane"
             display="360x640"
             skinId="qgn_graf_mup2_bar_frame"
             varietyId="0" />
    <Element colourId="text6"
             compName="main_mup2_pane_t2"
             loc_id="&lt;LC&gt;main_pane@v:15&lt;/LC&gt;&lt;LC&gt;main_mup2_pane@v:0&lt;/LC&gt;"
             text="sample"
             varietyId="1" />
    <Element colourId="text6"
             compName="main_mup2_t1"
             text="00:00"
             varietyId="0" />
    <Element colourId="text6"
             compName="main_mup2_t2"
             text="00:04"
             varietyId="0" />
    <Element colourId="text6"
             compName="main_mup2_pane_t3"
             loc_id="&lt;LC&gt;main_pane@v:15&lt;/LC&gt;&lt;LC&gt;main_mup2_pane@v:0&lt;/LC&gt;"
             text="Unknown artist"
             varietyId="1" />
    <reference screenName="TouchPaneButtons" />
    <Element compName="cell_sctrl_middle_pane_g2"
             skinId="qgn_prop_image_tb_prev"
             varietyId="1" />
    <Element compName="cell_sctrl_middle_pane_g2"
             loc_id="&lt;LC&gt;grid_sctrl_middle_pane@v:1&lt;/LC&gt;&lt;LC&gt;cell_sctrl_middle_pane@v:1#r:1#c:2&lt;/LC&gt;"
             skinId="qgn_prop_image_tb_pause"
             varietyId="1" />
    <Element compName="cell_sctrl_middle_pane_g2"
             loc_id="&lt;LC&gt;grid_sctrl_middle_pane@v:1&lt;/LC&gt;&lt;LC&gt;cell_sctrl_middle_pane@v:1#r:1#c:3&lt;/LC&gt;"
             skinId="qgn_prop_image_tb_next"
             varietyId="1" />
    <Element compName="main_mup3_pane_t5"
             loc_id="&lt;LC&gt;area_bottom_pane@v:0&lt;/LC&gt;&lt;LC&gt;main_pane@v:0&lt;/LC&gt;"
             text="1/2"
             varietyId="8" />
    <Element compName="control_pane_g3"
             display="!360x640"
             skinId="qsn_bg_area_control"
             varietyId="0" />
    <Element compName="control_pane_g3"
             display="360x640"
             loc_id="&lt;LC&gt;area_bottom_pane@v:0&lt;/LC&gt;"
             skinId="qsn_bg_area_control"
             varietyId="0" />
    <reference screenName="BaseSoftkeys" />
    <Element colourId="text13"
             compName="control_pane_t1"
             loc_id="&lt;LC&gt;area_bottom_pane@v:0&lt;/LC&gt;"
             text="Options"
             varietyId="4" />
    <Element colourId="text14"
             compName="control_pane_t2"
             loc_id="&lt;LC&gt;area_bottom_pane@v:0&lt;/LC&gt;"
             text="Back"
             varietyId="4" />
    <Element colourId="text1"
             compName="title_pane_t1"
             text="Now Playing"
             varietyId="5" />
  </preview_image>

</Preview>